brand,rating,review,date_experience,Identified Risk
Temu,1,Attention à ce site ne tombé pas dans leurs pièges il vous annonce des mensonges j'ai effectuer un achat de 51 euros et et normalement je devrais avoir 2 cadeaux gratuit j'ai reçus un message comme ci mes cadeaux étais envoyés mais j'ai trouvé aucune trace et quand j'ai contacté le Service client le conseiller qui avais malheureusement aucun pouvoir sont travail c'était juste vous consoler rien de plus m'avait annoncé qu'il arrive même pas à voir le message que j'ai reçus donc faite attention car vous recevez des tonnes de cadeaux et messages mais rien de concret c'est de la pure arnaque.Je rajoute à cet avis mon expérience avec le service client après des échanges avec des conseiller de différents grade ou( poste) j'ai reçus une réponse qui m'avais choquée il me propose de passer un nouvelle commande ça veut dire acheté de nouveau articles pour que je puisse bénéficier des cadeaux ça veut dire comme n'importe client qui passe une commande il veulent pas faire marché arrière pour réglé le problème. Temu est une arnaque faite attention car ils vous envois des tonnes de messages comme ci t'a gagné des cadeaux mais à la fin tu te reçoit que les articles que vous avez payer. Ça sera ma dernière commande chez temu et je déconseille ce site. Ces concurrents asiatique sont milles fois meilleurs dans la gestion des problèmes.,30 novembre 2024,Problème de service client
Temu,1,"2 commandes passées, la première ne correspond pas à ma commande, la 2ème non reçue, alors qu'ils confirment : livré le... or nullement livrée et je découvre que le produit est en rupture et ils continuent leurs mensonges et escroqueries en promettant une réexpédition ce que je ne veux pas j'attends qu'ils me remboursent  et tchao  à jamais",21 novembre 2024,Problème de livraison
Temu,1,"Je cherche le mot mais tout ce qui me vient à l’esprit c’est « arnaque ». Entre ce que l’on vous promet et ce que vous obtenez c’est le jour et la nuit. Je tiens dans mes mains les produits et je regarde les photos. Ben ce n’est pas la qualité affichée dans les photos. Sans parler des « promotions », « crédits » ou « coupons »… que vous n’arrivez jamais à avoir… Je viens de recevoir un message boombastique me faisant miroiter 90 eur de « crédits ». Ils mettent sous notre nez un système de « pièces / coins » auquel on comprend rien. Mais on sent tout de même l’arnaque… pour faire simple il vous faut acheter des produits totalisant 10 eur minimum pour avoir d’emblée le nombre de pièces pour pouvoir obtenir 90 eur de « crédit ». Ok, je fais une commande pour 16 eur (qui est donc largement suffisante pour obtenir les « pièces » pour ensuite obtenir les « crédits »… Vous suivez toujours ? Je paie la commande et le grand message arrive : «  Vous avez obtenu un crédit de… 2 eur! ». Vous voyez l’arnaque ?? J’ai immédiatement annulé cette Commande et jeté à la poubelle l’appli!",04 décembre 2024,Problème de remboursement
Temu,1,"J’ai toujours été contente des articles de Temu mais cette fois je suis vraiment dégoûté !!! J’ai renvoyé 8 articles de ma dernière commande, j’ai reçu un mail de Temu comme quoi ils avaient bien reçu mon colis et quelques jours après, je reçois un mail comme quoi les articles n’étaient pas dans le colis!!!! Tout était bien emballé dans un sac et soi-disant aucun article s’y trouvait !!!! Bien sûr ils ne veulent rien rembourser malgré des dizaines de mails que j’ai pu faire. Toujours les mêmes réponses automatiques qui reviennent. Plus jamais de ma vie, je commanderai sur Temu À moins qu’il se décide à me rembourser ce que j’ai bien renvoyé!!!",23 novembre 2024,Problème de remboursement
Temu,1,C'est vraiment des voleurs j'ai prouvé que je n'avais pas reçu un article dans une commande au vu des dimensions du colis. Peux importe notre parole le service client ne rembourse jamais un article perdu ou volé. Rien à faire de la loi qui responsabilise le vendeur sur la livraison. C'est toujours de notre poche.Même après avoir répondu par rapport à leur réponse sur trustpilot je n'ai fait que perdre mon temps.,29 novembre 2024,Problème de service client
Temu,1,"Pratiques commerciales malhonnêtes.  Après plusieures commandes, il m’est proposé, sur le site de Temu, plusieurs cadeaux à choisir conditionnés par une commande de 40€ minimum. Je passe une commande de 40,03€ que je reçois mais sans les cadeaux.",03 décembre 2024,Problème de service client
Temu,1,J ai renifler l arnaque s sur les délais. Ils rajoutent les délais au fur et a mesure ça peux durer des semaines. Cette entreprise dois fermer car elles ne respectent pas les règles commerciales française.Ils mentent sur le tchat ils mentent sur les écrits du site. Si je suis pas rembourser j invite les consommateurs a me contacter pour une procédure commune devant le tribunal .j,03 décembre 2024,Problème de remboursement
Temu,2,Il y a parfois des produits que je ne trouve pas ailleurs qu'ici mais j'évite vraiment car c'est un site chinois et ça ne respecte pas mes valeurs écologiques.,16 septembre 2024,Problème de qualité du produit
Temu,2,"Sur 4 commandes 2 livrées dans les temps.Mon colis devait arrivé le 29 novembre nous sommes le 3 décembre 2024.Plus de nouvelles , en transit et pas de mise a jour depuis une semaine. Oui il donne en cas de retard 5e à déduire sur une autre commande .Mais je n'ai plus l'intention de commander , perte de temps.Au moins avec Aliexpress j'ai toujours reçu mes colis et shein pareil , je suis simplement déçue. Par contre en quelques minutes ils vous remboursent sans problèmes sur PayPal",03 décembre 2024,Problème de livraison
Temu,1,"Colis non reçu! (D'une valeur de plus de 40€). On me dit qu'il a été livré alors que je n'ai rien reçu on me communique le numéro de tel du transporteur mais numéro non attribué. Impossible de communiquer avec le vendeur local. Aucun remboursement ou réexpédition!! Fuyez, grosse arnaque!!!PO-069-19928943519271391",03 décembre 2024,Problème de livraison
Temu,1,"Expérience désastreuse !!!! Commande faite sur le site et colis à transporter par POST NL (tout aussi désastreux). Suite à l'annonce de la livraison, je reste chez moi pendant 2 jours. RIEN, aucun colis, lorsque je reçois fin de la seconde journée, un avis disant que mon colis avait été livré...où, personne ne pouvait me le dire. Après 10 jours de recherche, d'envoi de mails et de coups de téléphone au cours desquels TEMU et POST NL se renvoient la balle, mon dossier a été définitivement classé!!!! Et donc aucune intervention et perte sèche pour moi. Donc la garantie ""protection des achats reprise sur le site TEMU est un leurre !!! Surtout, ne tombez pas dans le panneau comme moi",21 novembre 2024,Problème de livraison
Temu,1,"Une expédition trop longue. De novembre on me dit que je vais recevoir mes articles en janvier. Honteux Total de ma commande 149,63 euros. Et une autre commande non reçue également de 178,12 euros. Discussion avec un tchatbot.",03 décembre 2024,Problème de livraison
Temu,1,"Temu est une ESCROQUERIE : une facture de Chf 19.65 qui, suite à 2 rappels (j’ai été hospitalisé et n’ai pas pu m’acquitter de  cette facture dans les délais) passe à plus de Chf 60.-!!!!! Et voici leur réponse qui est est une preuve de leurs: »Soyez assuré qu'AUCUN frais supplémentaire (y compris les droits de douane) ne vous sera facturé, et nous avons toujours été transparents sur les frais facturés »",04 novembre 2024,Problème de remboursement
Temu,1,"J'essaie de passer une commande mais le paiement n'est pas accepté, je ne comprends pas ?",02 décembre 2024,Problème de remboursement
Temu,1,le livreur laisse les colis dehors sous la pluie et à la vue de tous et cela fait dejà 3 fois,02 décembre 2024,Problème de livraison
Temu,1,Mes commandes dites livrées à mon adresse ne l ont jamais été et ne le sont toujours pas Par contre les prélèvements sur mon compte ont été faits le jour même  de mes commandes Ma boîte mail est envahie de messages commerciaux et mensongés de TEMU sans avoir aucune réponse crédible aux essais d échanges faits avec leur robot. C est une honte de laisser l accès à cette entreprise de vente en France Je vais porter plainte,10 novembre 2024,Problème de livraison
Temu,1,"Très mécontent, leur service livraison est catastrophique ! Ils envoient même des photos d’une autre boîte aux lettres… ils livrent n’importe où… et plus rien après ! Pas de nouvelles !!!",30 novembre 2024,Problème de service client
Temu,1,"Temu averti une date de livraison par Post nl à domicile, mais le livreur ne passe pas mais dépose le colis dans un point relai sans avertir le client. Il doit y avoir un trafic avec le transporteur qui récupère le colis après quelques jours et ????  Moi je supprime l'application Temu. Pour obtenir l'adresse où mon colis était, j'ai dû insister par chat chez Temu. INADMISSIBLE",02 décembre 2024,Problème de livraison
Temu,1,"Nous avons commander plusieurs articles et nous attendons depuis 3 semaines, Aucune nouvelle de Temu, aucun moyen de prendre contact, et contrairement a ce qui a été écrit dans les réponses apportées par le service client sur trustpilot, impossible d'annuler les commandes et d'obtenir leur remboursement, C'était la deuxième et dernière commande sur ce site.",12 novembre 2024,Problème de service client
Temu,2,livraison pas conforme aux photos exemples j ai acheté plusieurs ensembles où la photo montrait de la maille et reçu du synthétique,05 novembre 2024,Problème de livraison
Temu,1,"Ne commandez jamais sur Temu , J ai acheté une litière robot à 200 euros qui marchait mal . J ai du coup demandé un retour . Temu m’a envoyé une étiquette pour que je puisse le renvoyer dans un point relais, sauf qu’arriver dans le point relais celui ci ne veut pas le prendre car le colis est trop volumineux . J ai tout de suite averti Temu et depuis maintenant 1 mois on me balade en me disant que la demande sera bientôt traité et rien ne se passe . Il on jouer sur le temps . Bref ce sont des escrocs . Je vous conseille AliExpress aucun problème avec eux .",11 novembre 2024,Problème de remboursement
Temu,1,j'ai commandé car je pensais avoir cadeaux gratuit en fin compte les cadeaux je l'ai est tous payés c'est de l'arnaque ( un achat = un cadeau ) et bien rien pas de cadeaux offert,01 décembre 2024,Problème de remboursement
Temu,3,A fuir...!!!.Ils vous proposent des cadeaux à 0€ puis vous renvoie sur une page pour acheter sinon pas de cadeaux. Renvoie régulièrement les commandes. Mauvaise qualité made in China !!!Plus jamais pour ma part,17 octobre 2024,Problème de qualité du produit
Temu,1,"On se ""MOQUE"" POUR NE PAS DIRE AUTRE CHOSE QUI VEXE !!! de nous pour les livraisons ! On me confirme livraison le 29 /11 entre 8h et 19 h ! Déjà ! 1 journée de bloquée pour rien, car personne ne livre ! BRAVO ! JE téléphone ! On me dit, une fois de + livraison le 30 ! Personne ne livre ! .... de + les soit disant cadeaux ! Alors qu'il faut acheter ! POUR MOI ! C'EST DES REMISES SUR ACHATS ! UN CADEAU, C'EST UN CADEAU ET NON UNE COMPENSATION EN RETOUR ETC.. POUR MOI ""TEMU"" C'EST TERMINÉ.",30 novembre 2024,Problème de livraison
Temu,2,"Le site en lui-même est bienCependant, les Prestataires employés pour effectuer les livraisons Sont médiocreLes commandes sont constamment marqué ""livrées En personne ""Alors que la réalité est ""livré À personne "" Le colis n'a jamais été réceptionnéEt ce n'est pas la première fois que j'ai ce problème-là avec temu",30 novembre 2024,Problème de livraison
Temu,3,"Attention, Temu malhonnête; supprime les avis négatifs et met 5 étoiles à la place de votre choix . Vécu personnellement.",29 novembre 2024,Problème de qualité du produit
Temu,1,"Première commande sur Temu et au bout de 3 semaines de rendent compte qu’ils n’ont plus de stocks et veulent me rembourser, je mets 1 étoile parce que je ne peux mettre moins, je supprime l’application.",09 novembre 2024,Problème de remboursement
Temu,1,Je suis client...ou plutôt j'étais client de Temu. Cette semaine j'ai  voulu passer une commande de moins de 20 €. Impossible le minimum de commande était de 20 €. Un conseiller m'a même écrit noir sur blanc (j'ai les captures d'écran) que TEMU me proposait 20% sans limite d'achat. Mais tout ceci était faux. Après plusieurs réclamations de ma part rien n'y fait le service client me propose 20% de réduction mais reste inflexible sur le minimum de 20€ de commande. Temu sous le prétexte de l'environnement force ses clients a prendre plus d'articles ce qui est totalement illégal. De plus je m'interroge sur la méthode de production des articles...sont ils attentifs a l'environnement lors de la production a bas prix ainsi des conditions de travail du personnels ?Bref je vous conseille de faire comme moi et DE FUIR TEMU AU PLUS VITE .,29 novembre 2024,Problème de service client
Temu,1,"A fuire aucune aide ni écoute client travail avec des indépendants qui sans foute complètement de vos colis les jettes sans prendre aucun soin les envois dans des points relais sous de fausse excuses,....etc",28 novembre 2024,Problème de service client
Temu,1,Des copier collé.COlis marqué livré mais pas reçu.On refuse renvoyer la commande ou de rembourser car dans le suivi marqué livré.Mais je demande une preuve de livraison et la on me parle a coté de la plaque. A fuir,28 novembre 2024,Problème de livraison
Temu,1,"À éviter !!!!!Au prétexte de se prétendre moins cher, 1 mois pour recevoir les articles.... Emballage colis en plastique sur-collé, 3 quarts et demi des colis sont décevants et partent en remboursement (ce qui n'est, je pense, pas l'objectif ni le principe de la manœuvre....)Vive amazon!!!!!",28 novembre 2024,Problème de remboursement
Temu,1,"J’ai commandé un tapis de marche qui est nul et maintenant que je demande le remboursement ils ne veulent pas me rembourser. Plus jamais je ne commanderais chez Temu.Pour répondre à votre question, je suis allé sur commandes retour/remboursement avant les 90 jours pour valider mon remboursement sur mon compte bancaire et bizarrement aujourd'hui j’ai une réponse sur mon compte client Temu que je n’ai,pas respecté les 90 jours Hallucinant!!! Cava être quoi votre réponse aujourd'hui ?  Et toujours pas d’appel de votre service comme je vous l’ai demandé. Je confirme NE COMMANDER PAS SUR TEMU DES ESCROS.",04 novembre 2024,Problème de service client
Temu,1,"colis incomplet reçu ouvert temu refuse de me rembourser le sac a 26euros, ils se dégagent de toutes responsabilités et ne prends même pas la peine de contacter le transporteur alors que c'est au vendeur de faire une plainte! Message robotiser en boucle et mielleux au possible...personne ne vous écoute !!! A fuir en cas de problème ils ne vous aideront pas ! ils disent qu'ils remboursent en cas de problème c'est un gros mensonge réponse a temu je n'arrete pas de vous contactez tous les jours vous refusez toujours de me rembourser voilà!",21 novembre 2024,Problème de remboursement
Temu,3,"J'ai commandé sur Tenu certains articles  : la qualité est  très aléatoire . Ce qui explique des prix aussi bas. J'ai acheté plusieurs eclairages solaires: ils marchent mal et s'arretent après 1h de lumière. Des sytèmes d'arrosage mis dans les pots qui se vident aussitôt..... et surtout des délais longs et aucune facon de les joindre sauf avec un IA qui ne sait dire qu'une chose : ""je n'ai pas compris votre question...."" Je peux dire que j'ai eu quelques articles satisfaisants, et à un prix très compétitif.Les commandes  concernées : #PO-069-13005531774074001.l’eclairage tient une bonne heure et s’eteintCde : #PO-069-13198814863994001 l’éclairage s’arrête très vite et ne tient pas des heures etc…..",23 septembre 2024,Problème de qualité du produit
Temu,1,"Le pire site sur lequel j'ai acheté des choses !!! Rien n'est jamais la faute du site qui est pourtant ""maître d'oeuvre"" comme on dit légalement, tout est toujours de la faute des autres !!! On se croirait à la maternel, madame ce n'est pas moi c'est l'autre. Lamentable. Plus jamais de ma vie je ne ferai de commande sur ce site catastrophique.",19 novembre 2024,Problème de qualité du produit
Temu,1,Catastrophique !!!!!Première commande sur ce site.Commande encaissée mais beaucoup trop de complications pour être livré. Non livré par ailleurs. Forte suspicion d’arnaque grossière !!!!!!! À fuir je pense.,26 novembre 2024,Problème de livraison
Temu,1,"Vous n envoyez pas en Polynésie française,  pourquoi ?",26 novembre 2024,Problème de livraison
Temu,1,"Produit qui ne correspond pas à la description: PAS REÇU LA TAILLE QUE J'AI PAYÉE POUR .Taille reçue trop petite! J'ai commandé 1,30 et non pas 1 mètre. Ce SITE N'EST PAS SÉRIEUX surtout que sur le site une image démontre le produit détaillé avec les mesures par des flèches; la réalité est tout autre.Au final produit cher plus de 90 $ alors que sur les autres sites le même produit est moins cher. L'emballage est médiocre le produit est tout tordu à son arrivée. TRÈS DÉCUE DE CE SITE !!!!",22 novembre 2024,Problème de livraison
Temu,1,"Bonjour,Voilà j'ai commandé sur temu et je n'ai rien reçu par contre ils ont pas oublié de débiter mon compte une arnaque parmi tant d'autres sur le net je le ferai plus confiance à ce genre de site",15 novembre 2024,Problème de remboursement
Temu,1,Site à fuir on paye une livraison à domicile et il ne livré pas et ne rembourse pas une plainte collective est sur le point d être déposé,25 novembre 2024,Problème de remboursement
Temu,1,Aucun colis livré par colis Privé Aucune nouvelle de TemuRienA fuir,19 novembre 2024,Problème de livraison
Temu,3,"Commandé plusieurs petites choses. Tout est de mauvaise qualité …pas cher pais fragile, comme un support de brosse à dents, clé de dentifrice, poubelle de cuisine livrée petit modèle 25cm. Plaque de plastique transparente munie de petites lumières pour lire un livre dans la pénombre, rudimentaire. Retourné tout ce qui était en textile. Remboursé! Merci à Temu pour sa réponse très professionnelle et les nombreux »kados » proposés pour entraîner une nouvelle commande! Le but n est pas de retourner tout ce qui est arrivé pour une vingtaine d euros. Tant pis. Je ne me laisserai plus prendre .",15 novembre 2024,Problème de qualité du produit
Temu,3,1. Ras le bol des mails avec des cadeaux à l'appui qui poussent à la consommation 2. Depuis l'application je ne sais pas comment j'ai fait j'ai validé le paiement d'un panier3. Dans la minute j'ai annulé la commande et ils m'ont répondu qu'ils avaient pris en compte l'annulation 4. Pourquoi malgré l'annulation 3 articles du panier m'ont été envoyé dont 1 reçu ce jour ?!4. Pour éviter les mauvaises manipulation j'ai supprimé ma cb sur le site et tant pis si je devrais la remettre pour mes commandes à venir5. Les 5 euros offerts si la livraison n'arrive pas à son délais sont des AVOIRS et non un vrai remboursement JE NE SUIS PAS TRÈS CONTENTE même si il est vrai que l'on y trouve des choses intéressantes,20 novembre 2024,Problème de livraison
Temu,1,J'ai commandé des porte-clés et je ne les est pas reçus. Grosses arnaque  je suis déçue 😞 je déconseille d'aller sur temu...,01 novembre 2024,Problème de livraison
Temu,1,"j'ai passé une commande de plusieurs articles autour du 20 octobre, j'ai reçu en 2 colis, mais INCOMPLET car j'ai jamais reçu mon sac et le lot de 10 chaussettes, et vous avez annulé mon remboursement, c'est un vol. Je pense que l'achat en cours en ce moment sera mon dernier avec vous, c'est un manque de respect et de la foutaise, malgré mon ancienneté chez vous.",17 octobre 2024,Problème de livraison
Temu,1,Attention A ces escrot livré n importe où sauf à l adresse donné et ne rembourse pas   ali expresse amazone shein vende exactement les même produit et sont bcp plus sérieux,24 novembre 2024,Problème de remboursement
Temu,1,"J étais très bon client mais aujourd’hui très très déçu de ce site suite à un retour d une montre qui m a été crédité, j en ai rachetée une sur Temu et finalement il m ont repris leur remboursement sur mon compte bancaire ! Donc j annule mon compte client et ma compagne va faire pareil . Je ne recommande pas Temu surtout leur SAV ! À BANIR",01 février 2024,Problème de service client
Temu,2,Les commande tarde trop a arrivé,07 novembre 2024,Problème de livraison
Temu,1,"Bonjour, commande de 90 euros livrée à un voisin. Je ne retrouve pas le colis et Temu refuse de me rembourser. La communication avec le service client car les bots me répondent que la commande est livrée ! Elle est livrée, oui, mais à un inconnu. Je viens de recevoir un mail du service client, impossible de me rembourser... Pour vous répondre : commande PO-069-06080389801512303 livré à un voisin (donc un inconnu), vous avez fermé le ticket, j'en ai créé un nouveau. La procédure pour contacter le service client est fastidieuse. J'attends le remboursement et je modifierai l'avis.",23 novembre 2024,Problème de livraison
Temu,1,J'ai commandé plusieurs fois chez Temu mais je suis très déçu les photos sont truquées c'est de l'arnaque la taille des objets en photos les tissus la qualité c'est sur c'est pas cher mais tout est chinois termine Temu de plus leur politique est très agressive avec leurs cashback.,25 octobre 2024,Problème de remboursement
Temu,1,"Plus jamais je commande sur ce site !!!!! 1 mois et demi  d attente pour un colis est toujours rien reçu!!!!! Service client qui sert a rien inexistant !!!!! il parle de mise à jour de la commande, je peux même pas me faire rembourser car tous les jours il faut une mise à jour !!!!!! mais le colis ne bouge pas!!!!! exprès pour pas que je me fasse rembourser après le délai de 15 jours!!!!!!!",23 novembre 2024,Problème de service client
Temu,1,"Première commande sur ce site …. Et dernière ! J’ai voulu tester … !!! Sur la dizaine d’articles commandés, 7 ont été retournés ! Qualité plus que médiocre surtout les pulls. On dirait de la paille ! Et les finitions… parlons en !!! Bref site pas cher mais son concurrent bien connu propose des articles de meilleure qualité !",23 novembre 2024,Problème de qualité du produit
Temu,1,"⚠️ grosse arnaque J'ai payé j'ai commandé un paquet il n'est jamais arrivé pas de nouvelles  ni remboursement, ce sont des arnaqueurs,plus jamais  .bon achat 5 euros  commande 61 eu ridicule  j ai payé  pour rien et aucun remboursement",22 novembre 2024,Problème de remboursement
Temu,1,"TEMU proposait un bon de 20€ pour un achat de 50€ dans le cas où l'on recevait le colis dans un point de retrait , il devait me le transmettre dès le retrait du colis.Publicité mensongère je n'ai pas eu droit au bon , et quand je l'ai réclamé je suis tombé sur une intelligence artificielle qui m'a balladé. Je suis très déçu , je suis retourné chez Aliexpress où ce genre de déconvenu ne m'est jamais arrivée.",22 novembre 2024,Problème de remboursement
Temu,2,"TEMU est un site où je commande très souvent et je suis assez rarement déçue. À chacune de mes commandes j'utilise le cashback TEMU proposé par iGraal.Les dernières commandes que j'ai effectuées en octobre novembre et même au mois de septembre aucun de mes cashback n'a été validée par TEMU et je ne parle pas de confirmer,  simplement de valider. Contrairement à SHEIN dont le cashback est validé deux heures après dans l'application, TEMU ne prend même plus la peine de valider de manière à ce que le cashback apparaisse sur l'application iGraal. Très décevant. Je ne peux nier qu'au début de mes premières commandes mes cashback ont été validés et confirmés. Mais maintenant ça n'est plus le cas. Dans ces conditions pourquoi TEMU propose des cashback avantageux sur iGraal. Finalement c'est de la poudre aux yeux je suis très très déçue.",24 octobre 2024,Problème de remboursement
Temu,1,"tres insatisfait de la livraison de temu.j'ai regle 5,90 pour une livraison express mais celle ci arrive exactement comme si je n'avais pas paye pour etre livre en expres.je' contact temu qui ne tiennent pas compte de vos remontrance et ne repondent pas as vos questions mais completement a cote.impossible de se faire rembourser les frais de 5,90e soit sisant qu'il ne peuvent pas mais pour les prelever la ils peuvent a partir de ce jour j'eviterai de me servir chez eux",22 novembre 2024,Problème de livraison
Temu,1,"j'ai commandé des articles avec une livraison prévue à mon domicile.  En plus d'avoir 6 jours de retards,  celle-ci a été déposée dans un point relais à 10 kms de chez moi !!  Et je n'ai pas de voiture !C'est la 2eme fois que cela se produit avec TEMU alors que passe souvent des commandes chez le concurrent Aliexpress et que je n'ai jamais eu de soucis. Par conséquent, je ne passerai plus de commande chez Temu !!",22 novembre 2024,Problème de livraison
Temu,2,"J’ai commandé plusieurs articles pour la première fois mais le livreur ne veut pas me livrer à domicile, je ne peux pas aller les récupérer je suis seule et handicapée, je ne pourrai plus commander chez vous si les colis ne sont pas livrés chez moi. Je suis au Maroc à Essaouira et je vous conseille de choisir un autre transporteur qui serait plus fiable et polis avec les clients.",22 novembre 2024,Problème de livraison
