brand,rating,review,date_experience,Identified Risk
Temu,1,"Bonjour, je voulais poser une réclamation. J'eu 3 fois le bon de -100% en croyant que j'allais avoir 100% de bon, je posé la commande. En aucun moment le montant a payé était visible, une fois validé la commande j'eu 30€ de réduction pour une commande de 93€, puis lendemain vous avez prélevé le montant de la réduction sur n'était pas de tout 100% comment promis en fait je tout payé sans même savoir, le 2eme paiement je n'ai pas approuvé, mais était prélevé sur ma carte que vous avez registre sans mon autorisation. Pourtant j'avais annule la commande avant l'expedition.Je souhaite être remboursé je ne veux pas la commande passé. Je bien contacté Temu, je reçu un email que je serai 100% remboursé, et à la fin on me demande de payer 58,50€ donc je ne pas donné suite à cette escroquerie, attention c'est tout du faux, mille une roue de la fortune, vous tirez le maximum et vous n'avez rien.Le 18.08 je reçu une message email pour être 100% remboursé, puis je cliqué, j'eu 1000% remboursé, je suis allé jusqu'au bout et à la fin, sans rien commander on me demandé de payer 58€.TRUSTPILOT ME DEMANDE DOCUMENTATION:CETTE COMMANDE INDIVIDUELLE JE N'AI PAS PASSE:ExpédiéesDate de commande : 11 août 2024Numéro de commande : PO-069-09801208271992781La confirmation de commande a été envoyée le 11 août Méfiez-vous des messages demandant des frais de livraison supplémentaires.Livré à FranceModifier l'adresseDélai de livraison19-28 août, 76,4% dans les 13 joursGarantie de livraison5,00€ de crédit en cas de retardRemboursement pour absence de mise à jour pendant 15 joursRetournez l'article s'il est endommagé.Remboursement pour non livraison sous 30 joursLot de 6 culottes taille haute à blocs de couleurs, Confortables et élégantes, respirantes et extensibles, Dessous féminins et sous-vêtements25,99€Rose Rouge + Rose Rouge + Gris + Gris + Violet + Jaune / XL(44)×1ExpédiéesDate de commande : 11 août 2024Numéro de commande : PO-069-09801155702392781La confirmation de commande a été envoyée le 11 août 2024 à  FranceModifier l'adresseDélai de livraison19-28 août, 76,4% dans les 13 joursGarantie de livraison5,00€ de crédit en cas de retardRemboursement pour absence de mise à jour pendant 15 joursRetournez l'article s'il est endommagé.Remboursement pour non livraison sous 30 joursChaussures de sport décontractées pour femmes, chaussures de course respirantes à lacets à imprimé léopard tissé volant, chaussures à plateforme confortables.GratuitBlanc / CN41(EU40)×1La pointure affichée correspond à la taille EU que vous avez sélectionnée.Robe à imprimé floral, col en V, décontractée, manches courtes, color block, vêtements pour femmesGratuitlac bleu / XL(44)×1T-shirt à col cranté à imprimé floral, T-shirt vintage à manches courtes pour le printemps et l’été, vêtements pour femmesGratuitBleu marine / XL(44)×14 soutiens-gorge de sport creux en maille, confortables et sans couture, gilets de sport intimes, lingerie et sous-vêtements pour femmes13,09€Couleur mélangée / XXL×1Slips Colorblock 6 pièces, culottes intimes extensibles et respirantes confortables, lingerie et sous-vêtements pour femmes25,49€Couleur mélangée / XL(44)×1Culottes De Contrôle Du Ventre Taille Haute 6 Pièces, Culottes Intimes Respirantes Et Confortables, Lingerie Et Sous-vêtements Pour Femmes24,49€Noir / M(38)×1Détails de paiementToutes les données sont cryptéesTotal de la commande :63,07€Total des articles :96,24€Réduction :-33,17€Livraison :GRATUITETotal de la commande :63,07€TVA de 10,51€ incluseVous avez économisé :-33,17€",12 août 2024,Problème de remboursement
Temu,1,"40 jours passé et remboursement non reçu de la part de temu,je vais faire un scandal sur les reseaux sociaux sur l'arnaque de temu si vous me rendez pas mes 81,4 euro.le service client temu maroc et nul nul nul aucune reponse favorable que du blabla et copier coller du scripte ...ticket de mon probleme est:1722938597135440 rendez moi mon argent bon de voleur",11 juillet 2024,Problème de remboursement
Temu,3,Jusqu'à présent temu c'était bien Maintenant les minimums de commandes augmentent de façons rapprochées Il serait temps que ça s'arrête 15 € puis 20 € au lieu de 10 € au départ 😡,13 août 2024,Problème de livraison
Temu,1,"Pour améliorer votre site , arrêter des mails sur une adresse dont mon compte ""bloque"" ce pub ( bloquerau minimum 40 fois et.........................trois autres pubs dans l'heure qui suit Sachant que votre nom est connu , si je veux chercher quelque chose, je sais où le trouver, mais plus vous insistez plus je chercherais ailleurs bon entendant...",14 août 2024,Problème de service client
Temu,2,J'ai acheté chez Temu et au moment de retourner pour remboursement. AUCUNE ETIQUETTE valable pour réexpédier. On obtient des étiquettes de retour de très petites dimensions et où les codes barres sont illisibles. Je n'achèterai plus jamais chez eux,13 août 2024,Problème de livraison
Temu,1,"Article non conforme à la description, pas professionnel du tout,  demande de remboursement car pas de solution. Site d'arnaques pour novice",13 août 2024,Problème de remboursement
Temu,3,"dommage que temu travaille avec colis prive .c est une catastrophe cette entreprise ,ils s ont capable de tous sauf delivrer.",02 août 2024,Problème de remboursement
Temu,1,Date de l'expérience: 13 août 2024,13 août 2024,Problème de remboursement
Temu,1,"J'ai beaucoup aimé TemuJusqu'à ce qu'un de mes colis lui a été retourné Et que Temu lui même me propose un remboursement Et là, c'est le championnat du monde de la triche et de la mauvaise foiEntre les codes de vérification (je me suis lassé au 4e), les images à compléter et les SMS), j'ai tourné en rond un bon quart d'heure Et à chaque fois, retour à la case départ Je laisse à Temu cette petite vingtaine d'euros Et je désinstalle son appli",13 août 2024,Problème de livraison
Temu,1,C'est une catastrophe les vêtements d'une qualité médiocre je peu comprendre vu le prix quand je l'ai récupéré j'ai eu cette impression qu'il a déjà été mis 10fois je vais zappé ce site,01 août 2024,Problème de qualité du produit
Temu,1,Toujours rien reçu après 15 jours.veritable arnaque,30 juillet 2024,Problème de remboursement
Temu,1,"Trop de pubs mensongères, oppressantes, produits non conformes, de mauvaises qualités. La seule chose positive, c'est le traitement du remboursement qui est rapide.",13 juin 2024,Problème de qualité du produit
Temu,1,j'ai acheté un detendeur pour bouteille d'argon le raccord n'est pas compatible c'est un raccord male alors que pour les bouteilles d'argon c'est un raccord femelle celui ci se visse sur une bouteille d'oxygéne donc aucune utilité premier et dernier achat chez temu,06 juin 2024,Problème de qualité du produit
Temu,1,Comment on a les 3 cadeaux quandary in installe,12 août 2024,Problème de remboursement
Temu,1,Entreprise pas très nette vu qu'il refuse catégoriquement d'éditer des factures seul preuve légalement valable d'une vente. Aucun service après vente valable qui copie colle comme des robots les phrases déjà écrites. Rien à en tirer.,12 août 2024,Problème de remboursement
Temu,1,"Temu confié la livraison des colis à des transporteurs dont les coursiers livreurs VOLENT les produits quelques fois: CAINAIO...Ils déclarent le colis ""LIVRÉ"" alors qu'il n'est pas livré !!!!!LA Société PAACK AUQUEL TEMU A CONFIÉ LA LIVRAISON D'UNE COMMANDE EST ÉGALEMENT NON FIABLE!!!!Le livreur déclare la commande ""LIVRÉE"" alors QU'ELLE N'EDT PAS LIVRÉE Mon voisin qui a commandé sur TEMU  en a été victime",25 juillet 2024,Problème de livraison
Temu,2,"Vraiment plus que bofJ'ai effectué plusieurs commandes, dans toutes un article minimum est passé directement à la poubelle car défectueux ou horrible ne correspondant ni à la description ni aux photos.Maintenant il faut 20 euros pour éviter les frais de port, l'envoi est beaucoup moins rapide qu'Aliexpress ou SheinEn quelques mois Temu m'a dégoutée de faire mes achats chez eux",10 août 2024,Problème de qualité du produit
Temu,3,"j ai acheté un émulateur électrique, délai respecté au niveau de la livraison.fonctionne bien Mais quand j ai voulu le recharger 3 semaines après mon achat, IMPOSSIBLE le cordon ne correspond pas à  l appareil Donc INUTiLISABLEtrès déçue.",03 juillet 2024,Problème de livraison
Temu,1,"J'ai commandé beaucoup de produits, mais le problème que l'achat minimale augmente progressivement.  J'avais 10 chf pour la première commandé,  après J'avais 20 chf et aujourd'hui c'est passé au 25 chf. Service client ne sert à rien. Je pense que c'est un robot qui parle.  Les même phrases "" copier,  coller "" .Sur leur site c'est bien noté que prix d'achat minimale est à 20 chf pour les clients !!! C'est très malin à augmenter progressivement le taux d'achat minimale et pousser vers la consommation.  Très déçu !!! C'est malhonnête !",10 août 2024,Problème de service client
Temu,2,"J ai fait plusieurs commandes sur TEMU. Le 23 mai il m a été livrer une commande en 2 colis. 2 articles manquaient, et ils refusent de me rembourser sous prétexte que les colis sont bien partis de l entrepôt ! C est de l escroquerie. De plus, les livraisons sont longues et pas toujours de bonne qualité !",23 mai 2024,Problème de qualité du produit
Temu,1,Plus voleur tu meursNe respecte aucun engagement Faire très attention avant de cliquer pour achat Somme annoncée n’est pas toujours la somme prélevée Bref ! Je ne recommande pas,10 août 2024,Problème de remboursement
Temu,2,"J'ai commencé à commander vers septembre 2023 et le mini d'achat était de 10euros avec des produits  très sympa comme pour des câbles USB de 1.5 mètres à 0.7eur, coffret tournevis à 1.4€  etc Ensuite entre octobre et Avril j'ai eu de bonnes promos genre -80% ou j'ai pu avoir des lampes solaires 100 led  extérieure par 8 pour 7eur  ou encore commander des autres produits à -70% (5€ au lieu de 20€)  port offert à 10eur.Depuis mai port offert pour 15eur  D'achatEt cet été ces désormais 25euro d'achats pour les ports offerts .Et depuis cet été des fausses promos 100 ou 1000 % vos achats remboursés en bons d'achat avec des conditions bancales ou incompréhensible de remboursement + incitation à acheter 90€ de produits . Ou autres pubs type 2 produits offerts pour 40eur d'achat (40€ de produits sans vraie promos ). Et on reçoit ce type de promos tous les jours en mails En bref c'est de moins en moins intéressant",09 août 2024,Problème de remboursement
Temu,3,"Ce Site fait une publicité extrêmement agressive sur Insta. Des promesses non tenues sur les délais de livraison. Il y a toujours un prétexte pour une livraison tout ce qu'il y a de plus banal venant de Chine. 3 semaines en moyenne. Je n'achète que des bricoles qui sont de qualité égale dans les bazars parisiens, mais à des tarifs moindre. Les définitions des produits étant extrêmement flous quant elles existent, on comprend très vite la démarche marketing. Je ne suis donc pas déçue achetant en connaissance de cause : produits basique de moindre qualité livrés en 3 semaines.",09 août 2024,Problème de livraison
Temu,1,Vous m'aviez menti ils ya deux articles normalement sont gratuit si j'ai commandé plus et c'est le cas j'ai commandé plus mais vous m'aviez facturé les deux articles qui était cadeaux,06 août 2024,Problème de remboursement
Temu,1,"Probleme d'expédition très déçuJe suis très déçu par Temu. J'ai commandé un tancarville qui devait arriver beaucoup plus tôt, qui a été déclaré comme livré pendant mes vacances mais dont le colis n'est jamais arrivé. Le temps que je revienne de vacances, que je fasse ma réclamation chez Colissimo et qu'il cherche pour solutionner problème et déclare l'objet perdu, le temps de 30 jours pour demander un remboursement ou un ordre de réexpédition était écoulé et donc Temu refuse de me réexpédier ou de me rembourser l'objet commandé. C'est inacceptable. Il faut un peu de souplesse: l'acheminement a été beaucoup plus lent que prévu; les gens ont droit de prendre des vacances; et les mois d'été, toutes les démarches prennent plus de temps.",09 août 2024,Problème de service client
Temu,1,"Colis commandé le 24/07/24, expédié le 25/07/24 🤔,devait être livré entre le 01/08 et 08/08/24. Colis toujours pas reçu et aucune nouvelle !!!!!",09 août 2024,Problème de livraison
Temu,1,Publicité mensongère affichée lors de la consultation d'autres sites que Temu mentionnant que si on cree une application Temu on doit recevoir une valise d'outils. Après avoir créé cette appli on nous informe que cette  pub est terminée. Le lendemain  la pub apparait toujours.????ARNAQUE????Pub mensongère ???????,07 août 2024,Problème de livraison
Temu,1,"Avant je commandé presque chaque mois, mais depuis qu'ils ont changés leur minimum d'achat à 20€, je pense que je ne passerai plus par eux. C'est dommages.",08 août 2024,Problème de remboursement
Temu,1,"Des voleurs et des baratineurs …Une livraison avec la moitié des articles manquants , pour un préjudice de 100 euros ..Des multiples réclamations et un service client qui ne sert à rien ! Arnaque ..Je commande beaucoup sur Amazon et je n’ai jamais eu ce problème.A fuir",16 mai 2024,Problème de livraison
Temu,1,"Contrairement à de nombreuses plates-formes internationales, je mets un carton rouge à TEMU.1 Aucune garantie produit de 1 an comme partout ailleurs.2 Les produits sont de très mauvaises qualités.3 Les vendeurs ne restent pas longtemps sur la plate-forme Temu, du coup impossible de contacter le vendeur 5 mois après.4 Temu est une plate-forme de fraudes puisque dans le cadre de ma profession, je détecte des pages entières de contrefaçons. J'en suis déjà à 45 vidéos de fraudes. Ou même Temu sur des produits contrefait se permet de dire :// Nous avons bien reçu votre signalement du 2024-05-05 au sujet de l'article sur Temu. Après avoir examiné attentivement votre signalement, nous avons le regret de vous informer de notre décision de ne pas retirer cet article de notre catalogue, car nous jugeons qu'il ne contient pas de contenu interdit en vertu de nos Directives de la communauté. //Du coup, je détiens une preuve une pièce a la conviction lors de leurs procès prouvant leurs mauvaises fois, et ce croit tous permis sous prétexte de leur communauté. Ce site sera bientôt sanctionné et j'espère banni a l'international.Je n'en ai rien à faire de la communauté TEMU de la contrefaçon, ce ne sont pas eux qui décident si cela doit dégager ou pas, c'est la loi contre la contrefaçon.vous clients de TEMU n'achetez pas de produit de contrefaçon, c'est vous qui serez puni à cause de TEMU.J'ai fermé mon compte TEMU, ça suffit, je ne vous recommande pas TEMU à éviter.J'ai enqueter sur TEMU plus de 40 videos de contrefacon et aussi des preuves que la qualite et pourrite sur TEMU c'est pas cher Temu mais c'est de la mauvaise qualite je vous ai envoyez des preuves ou des produits de mai sont deja mort .",06 août 2024,Problème de qualité du produit
Temu,1,Bonjour Plusieurs commandes passées sur ce site.Colis reçu .Mais depuis plusieurs jours j'attends désespérément mes 2 commandes d'une valeur de 90 euros.Réclamations on me réexpédie mes commandes mais toujours rien dans ma boîte aux lettres malgré le suivi qui affirme que les colis ont été livrés.Il ce renvoi la balle entre colis Privé et temu!!!J'attends un remboursement qu'il refuse de m'accorder.Fuire ce site est la meilleure chose à faire,06 août 2024,Problème de livraison
Temu,1,Bjr à tous on m’a déconseillé Temu par des proches je voulais avoir ma propre expérience mais je vous assure c’est à fuir ce site depuis que ma commande était en cour ça fait une semaine ils font que reporter plus jamais temu,24 juillet 2024,Problème de livraison
Temu,1,Acheté un balai serpillère avec le seau..le manche est trop petit et ne se règle pas.. impossible d'essorer car la lavette se plie...quand on prend le seau par la poignée il se renverse... très déçu,15 juillet 2024,Problème de qualité du produit
Temu,1,"Super site ! Je ne reçois pas mon colis prétendument livré et TEMU ne rembourse pas c’est super !! Ceux sont les rois des belles paroles, excuses mais ce n’est que du bla-bla ! Leur client une priorité 🤣🤣🤣",22 juillet 2024,Problème de remboursement
Temu,3,"Jusque là tout allait bien ! Article bien c est trop de la bonne qualité vu les coutures au bout d' un mois sa s enlève...J ai reçu mon colis au mois de juillet il manque 2 articles, je le signale à temu, après quelques temps temu ne veut rien savoir  soit disant que tout les articles été bien dans le colis. Il faut pas prendre les gens pour des imbéciles ! J attend encore une commande et c est la dernière, je ne commande plus sur ce site ........",25 juillet 2024,Problème de qualité du produit
Temu,1,"Grosse arnaque attention. POUSSE A L’ACHATVous tournez une roue vous allez gagné 200€ de crédits. Que vous ne pourriez pas dépensé! En effet il ferai faire des tranches d’achat pour bénéficier de BON DE RÉDUCTION (5,10,20)€.CE SITE FAIT TOUT POUR QUE VOUS ACHETEZ. Vous fera tourner des roue comme dit ci dessous, vous donnera des crédits remboursé en échange d’achat, des réductions de folie après x achat. Mais la réduction n’est en faite pas une réduction c’est un article semblant en «  solde » breeffff Franchement je recommande, Amazon, alibaba que cet grosse daube",04 août 2024,Problème de remboursement
Temu,1,Bonjour pour la premeire fois je commandz sur temu jai tjrs pas recu ma.commande et m envous des remboursement 100 pourcent je cliques sur l article et finalement je paye larticle direct la carte est enregistrée je comprends pas trop le systme  de remboursement ca fait uen semaine aucun.mail aunce nouvelles de mes comma.des et pourtant  deja pteleve sur mon compte je comprends pas,04 août 2024,Problème de remboursement
Temu,2,"Dans l'ensemble c'est très très bon marché. Donc...ne pas s'attendre à de la très très bonne qualité... Et un minimum de commande est obligatoire. Bref, pas mon style",24 juillet 2024,Problème de qualité du produit
Temu,1,"La commande a été passée le 29 juin avec un délai de livraison fixé au 31 juillet. Un mois, quoi ! chacun sait que venir de Chine n'est pas une garantie. Mais ils sot tellement pressant que je ne leur fais pas de cadeau. Aussi, j'ai tiré la sonnette d'alarme le 31 sans plus attendre. ils se confondent en excuses et vous donnent royalement  20 % de réduction sur une prochaine commande. ce qui relance la machine. Malin. Le conseil : tout ce qui peut être envoyé sous enveloppe peut être acheté. Le reste, ne tentez pas. Elisabeth",03 août 2024,Problème de livraison
Temu,1,Date de l'expérience: 22 juillet 2024,22 juillet 2024,Problème de remboursement
Temu,3,"Franchement, mon expérience avec TemuA été excellente au début mais comme toute entreprise qui commence, ils font tout pour satisfaire à leurs clients, surtout au niveau de la livraison et après une délègue à des sociétés Moins Cheres peut-être pour faire arriver le colis donc je reviens sur le fait que la qualité des produits n’a jamais été décevante. Cependant je pense que dorénavant les colis qui arrive rapidement, ne sera plus le cas",03 août 2024,Problème de qualité du produit
Temu,1,"Vous ne donnez pas de FACTURE,Votre reçu ne vaut rien pour la comptabilité d'un professionnelAliExpress, lui, en donne uneIl faut qu'il y ait écrit ""FACTURE"" sur la page",03 août 2024,Problème de remboursement
Temu,2,"Bonjour. Je suis un client de Temu et je voudrais faire profiter de mon expérience... En résumé, il faut dire que 70% des biens vendu sur ce cite ne sont pas de qualité. Il reste en effet que 30 % de bonheur qui peut tourner mal, avec le constat que vous pouvez trouver moins cher ailleurs land.Temu ne rembourse pas avec la preuve que sont produit est 2 fois plus élevé. Ténul  Temu ! Tu bloques le chatte et le recours. Tu fais le juste au début et je constate que tu es un arnaqueur ! J'ai constaté également que certain articles sont réduit à 50% de leurs matières pour un lot de 10, ce qui en fait 5 complet en réalité...Vous pouvez également voir dans la réponse de Temu, qu'ils n’apportent aucune solution puisqu'ils bloque le chatte en cas de problème.. Faites bien attention à vous, si vous achetez , regardez toujours les pages suivante pour voir le même produit de 15 à 50% de moins. Pour ce qui est de la livraison rien à dire, les commandes sont complètes ! Les photos des produits paraissent plus grandes également? IL faut faire attention... Ne donner jamais vos coordonnées bancaires .",02 août 2024,Problème de remboursement
Temu,1,Nul Dommage qu il n' y est pas 0 étoiles 4 colis non reçus Remboursement par crédit temu un cercle vicieux interminable Sav nul ne parlant pas français a fuir,01 août 2024,Problème de remboursement
Temu,3,Livraison un peu longue à ce qui avait été annoncé  !C’est presque les mêmes délais que son concurrent Aliexpress !,21 juillet 2024,Problème de livraison
Temu,1,"Inutile , de répondre ce qui suit:« Bonjour, merci d'avoir pris contact avec nous, et nous sommes désolés pour tout désagrément que cela a pu causer. La satisfaction du client est de la plus haute importance, et nous travaillons constamment à améliorer la qualité de notre service. Pourriez-vous s'il vous plaît nous contacter à nouveau via Temucom ou le chat en direct de l'application Temu afin que nous puissions aider et enquêter immédiatement? Vous pouvez également visiter wwwtemucom/support-centerpour trouver plus de contacts du service client. Nous vous remercions de nous donner une autre chance de vous servir. Meilleurs vœux, l'équipe Temu »Dans la finalité de la chose, toujours le même résultat donc je maintiens l’avis : -plus chère que la concurrence -le « service interne » sort une excuse de colis intacte en sortie d’entrepôt mais n’arrive à pas comprendre que pendant le transport un colis peu subir tout et n’importe quoi ce qui est arrivé avec mes 2 commandes en 1 colis et donc remboursement refusé sur une valeur total d’article manquant de casi 100€- le code de consommation surtout l’article 221-3 exprime bien que le client est en droit à non réception ou manquants ou colis détériorer de demander le remboursement partiel ou total.- en plus de cela j’ai fournis des preuves plusieurs fois , au total 7 conseillers par tchat et 4 appels pour entre dire que l’ont m’offrirais uniquement 20% de remise sur 20€ de dépenser.Donc c’est simple je ne verrais jamais l’argent perdu de cette commande donc vos réponses , comme quoi il faut vous contacter pour que ça passe positivement sur Trustpilot ça ne sert à rien soit vous demandez des infos pour prendre en charge le dossier et faites le boulot vis à vis de différents litiges et en respectant les lois du code de la consommation mais ne répondez pas à un commentaire pour vous faire passer pour des gentils.Ont m’a refuser une adresse de contact pour exprimer ma demande de remboursement des articles de ces 2 commandes , ont m’a juste dis« vous voyer l’adresse en bas du site débrouillez vous c’esten Irlande, et surtout si ont reçoit le courrier. Donc malhonnêteté 100% ( sans parler de jusqu’à mars 2024 la reventes des info perso des clients Temu n’est clairement tous blanc)Sur ceux bonne journées et j’espère que les clients quand ils verront la gestion fuiront vite",31 juillet 2024,Problème de remboursement
Temu,1,Une commande sur le site TEMU a été livrée par la poste - COLISSIMO à une mauvaise adresse. Le site TEMU ne permet pas de signaler cela mais renvoie sur son prestataire de livraison qui certifie que le colis a été livré. Donc le client qui a payé se retrouve a gérer un contentieux avec le prestataire du fournisseur puisque nous ne pouvons pas faire de réclamation au site dans ce cas. En conclusion pas de produit reçu mais une commande qui a bien entendu été payée à TEMU !!!!  Inadmissible !!!,31 juillet 2024,Problème de livraison
Temu,1,"La dernière fois que j'ai commandé chez Temu, j'ai eu une escroquerie sur mon compte. Je veux commander chez Temu, mais ma banque refuse d'enregistrer la carte !!!Pourquoi oblige t il les clients à enregistrer la carte ?Curieux, non ?Amazon, Cdiscount etc n'oblige pas à enregistrer la carte bancaire...Danger !",02 août 2024,Problème de remboursement
Temu,1,"Temu impose une commande de 20 euro mini il pour pouvoir acheter, la copine et moi avons désinstaller cette appli",02 août 2024,Problème de livraison
Temu,1,J'ai voulu acheter une paire de chaussures je n'ai rien reçu à part plusieurs retraits frauduleux de la part de c stars ... Je sais pas si ça a déjà arrivé à quelqu'un ?,02 août 2024,Problème de remboursement
