brand,rating,review,date_experience,Identified Risk
Temu,1,"Refus de me rembourser un article manquant a ma commande d'une valeur de presque 50€. Ils sont pourtant responsable de la bonne livraison de toute leur marchandise que ce soit un oubli ou un vol...! Honteux !Edit: merci pour votre réponse hypocrite mais j'ai demandé une dizaine de fois le remboursement qui n'a jamais été accepté, c'est honteux.",14 mars 2024,Problème de remboursement
Temu,1,"Le problème n'est pas temu, ils sont en partenariat avec ""colis privé"" pour la livraison, une belle brochette de bon a rien..(je pèse les mots pour ne pas dire f... .. ....!!!) des incapable qui ne prennent même pas la peine de se présenter à domicile, largue les colis ou ça leur chante   ... Bref même pour vendre des patates sur le marché je ne ferai pas appel a ces gens là...",05 avril 2024,Problème de livraison
Temu,1,"Les prix des articles changent au moment même de paiement, comme à la bourse. Et honnêtement la qualité n'est pas au RDV loin s'en faut. Le problème de mesures aussi. Je ne conseille pas.",05 avril 2024,Problème de qualité du produit
Temu,1,votre magasin vend des enfants et je l'est ai acheter mais j'ai reçu une poupée  gonflable c de l'arnaque votre site,03 avril 2024,Problème de service client
Temu,3,"malheureusement les notices ne sont pas en francais pour les outils de fabrication bijoux et je ne peux m en servir!!! voir mes commandes d outils!! d autre part il serait judicieux de mettre la facture et detail de commande dans le paquet qui,lui, est tres mal emballe et arrive tout comprime et froisse.une boite est arrivee felee!!! a remedier au plus vite merci",03 avril 2024,Problème de livraison
Temu,1,"Suite à une commande, j'ai reçu un avis de livraison pour aujourd'hui. Voici ce que je lis sur le suivi des colis :""Nous n avons pas pu livrer votre colis. Un complément d information est nécessaire. Cliquez ci-dessous pour plus d informations.""Je ne comprends pas ce message car l'adresse mentionnée est correcte et je sui restée à la maison.J'ai envoyé un mail et j'espère avoir une réponse et recevoir mon colis... à suivre.La réponse du service client via l'application ne comprend pas ce que je demande.Ma question est pourtant claire, pourquoi la livraison n'a pas été faite à l'adresse indiquée ???Impossible de joindre quiconque, je me retrouve face à un mur qui me répond ""suivre votre colis "" qui me renvoie à ""votre colis n'a pas pu être livré"".OU est mon colis ??? qui peut m'aider à le retrouver ???",04 avril 2024,Problème de livraison
Temu,1,Bonjour. J'ai passé une commande le 25 mars et je voudrais savoir où elle et arrivée. Merci,03 avril 2024,Problème de livraison
Temu,2,"Je tiens à exprimer ma profonde déception concernant ma récente expérience de livraison  chez Temu ,Au départ, j'ai toujours reçu mes commandes sans aucun problème via Colissimo, ce qui m'a amené à être un client fidèle et satisfait. Cependant, après avoir constaté un changement de transporteur privé pour mes dernières commandes, ma satisfaction a été grandement compromise.Lors de ma dernière commande, une fois de plus expédiée par votre transporteur privé, j'ai été choqué de découvrir que la moitié des articles étaient manquants à l'arrivée. Cela a entraîné une grande frustration et une perte de confiance dans votre service de livraison. J'ai immédiatement soumis une réclamation, comme demandé, et j'ai été contraint d'attendre j’attends toujours une réponse.après avoir fourni toutes les preuves nécessaires du contenu manquant, simplement allez regarder le forum de ce transporteur que de négatif.Cependant, cette expérience a entraîné un désagrément considérable pour moi en tant que client fidèle.Je suis convaincu que votre entreprise attache de l'importance à la satisfaction de ses clients, c'est pourquoi je tenais à vous faire part de mon expérience. J'espère que vous prendrez des mesures pour améliorer la qualité de votre service de livraison, notamment en réévaluant votre choix de transporteur privé.Dans l'attente de votre réponse et de mesures correctives, je vous prie d'agréer,",03 avril 2024,Problème de livraison
Temu,1,"2 mois que j’attend un colis, première livraison : la poste l’a réexpédié sans aucune raison et sans même me prévenir, ils me renvoi un autre colis, cette fois ci : l’étiquette du destinataire (moi) n’est pas lisible alors la poste le réexpédie encore dans leur dépôt à Amiens (preuve du suivi la poste) je les re contact et là c’est le drame, 2 mois que j’attend ce fameux colis pour 100€ de marchandises quand même! Ils ne veulent rien savoir, personne comprend un mot français c’est du grand n’importe quoi, ils ont la preuve que le colis a été réexpédié chez eux, je leur envoi de mon côté cette preuve en + mais ils ne veulent rien savoir, donc 100€ parti à la poubelle !! À fuir !! Commandez chez SHEIN, au moins il y a un bon service client car Temu vraiment plus jamais !!!",03 avril 2024,Problème de livraison
Temu,1,"Bonjour.Très mauvaise expérience avec temu le 10/03/2024,il y a eu un prélèvement de plus de 20 euros sur mon compte bancaire alors que je n'ai effectué aucune commande.Je les ai contacté, ils gagnent du temps en blabla, je ne laisserai pas faire.Je vais mettre des avertissements sur beaucoup de plates-formes pour dénoncer leur escroqueries..Vérifiez bien vos comptes.Je vous tiens au courant de la suite.",10 mars 2024,Problème de remboursement
Temu,1,"Remboursez moi toutes mes commandes je ne veut plus avoir a faire avec votre système d'escrocs, vos conseillers ne servent a rien, ils ne comprennent pas, ne font rien, je pense que l'on vous rémunère le temps passé sur votre site ... vous osez dire que le colis est livré a mon adresse alors qu'il est en relais colis ou a plusieurs centaines de kilomètres de l'adresse de la commande ! !!Comme je le disais : "" 9h d'échanges hier ou ils ont ete incapable de me dire à quelle adresse ils ont livré et la comparer avec l'adresse de ma commande Il vous explique qu'il n'ont pas accès et quand ATTENTION ESCRIQUERIE DE TEMU vous leur dites de consulter le suivi du colis et de le comparer avec la confirmation faites sur leur site ils commencent a bugger Leur seule réponse ses et en boucle sest de dire que le colis est livré a votre adresse même quand celle ci est à 350 km de chez vous dans un relais ou depot transporteur ! AUCUN SERVICE CLIENT !Je vois que vous n'avez pas l'intention de relever votre annotation sur internet et que le service et satisfaction client ne vous soucis guère!Commandes de janvier toujours pas livré ! Ca ne vous choque pas ! De bloquer votre client plusieures journées pleines sans que le livreur ne daigne se presenter et ce, sans excuse et sans prevenir ! Vous avez l'intention de prendre en charge mes frais de déplacement sirtout quand vous ne savez memme pas où se trouve le colis !?Je ne vous demande pas si vous comptez faire un geste commercial, vu que les commandes ne sont pas livré ou réexpédiés a une mauvaise adresse contrairement a ce que vous dites il n'en va pas de ma responsabilité ! Je vous ai dit d'attendreque la commandesoit complete avant de réexpédier ou de me rembourser, encaisser c'est votre fort ! Mais pour le reste ...Vu votre note je comprends pourquoi je n'ai pas de reponse !!! Si vous pensez etre les moins cher du marché vous vous trompé lourdement surtout pour ce type de service je pense que vous etes les pires !!! Mefiez vous de leur pratique ils ont un système tres bien ficelé!",02 avril 2024,Problème de remboursement
Temu,1,"J'espère que ce site d'escrocs fermera bientôt. Je vous mets en garde contre ces escrocs : en plus de la qualité médiocre de ce qu'ils vendent, ils ne respectent jamais leurs délais. Fuyez dès que possible et privilégiez d'autres sites plus fiables...",02 avril 2024,Problème de qualité du produit
Temu,1,"Des vêtements commandés à ma taille et reçus beaucoup trop larges, on me dit : pas nécessaire de les retourner, gardez-les ou recyclez-les, mais j,ai un remboursement en cours de 16,75 € que je ne reçois pas depuis un mois, mais le piège c,est un crédit sur une future commande que je dois faire bientôt sinon perdu, et je n,ai rien à commander, je veux récupérer mon argent",08 mars 2024,Problème de remboursement
Temu,1,"Bonjour,Faites attention à ce site, il s’agit d’une grosse arnaque. J’ai commandé pour un montant de 243.12€Les articles ne correspondent pas à la description, il y a plusieurs articles arrivée cassée, De très mauvaise qualité et ne correspondent pas du tout à l’image ( à la description de l’article ). J’ai retourné la marchandise depuis février 2024. On est au mois d’avril 2024. Le suivi indique que le retour a bien été réceptionné, mais ils ne veulent pas me rembourser car j’ai ouvert un litige PayPal. Ils m’ont demandé de clôturer ce litige pour qu’il puisse me rembourser. Ce que j’ai fait. Une fois que j’ai clôturé le litige de PayPal, ils se renvoie la balle et ils osent toujours me dire de voir avec PayPal pour mon remboursement. C’est totalement illégal de garder la marchandise et l’argent du client. Malgré que j’ai retourné la totalité de la marchandise à leur entrepôt de cergy.Je déconseille à toute personne de passer commande sur ce site, il s’agit agit d’une grosse arnaque si y’a un problème il ne vous rembourse pas. Je vais entamer des procédures judiciaire et porter plainte de mon côté.Si vous souhaitez échanger avec moi à ce sujet mon mail: tanunox gmail com",02 avril 2024,Problème de remboursement
Temu,2,Une fois l'application est téléchargée. L'harcelement commence. Trop de pub des propositions des notifications... obligée de la désinstaller.,01 avril 2024,Problème de livraison
Temu,1,"Des délais de livraison qui n'en finissent pas, des conditionnements aléatoire de la casse et vu les délais .... et beaucoup de plastique,  de photo trompeuse sur les gabarits des pièces vendues ... bref de la bonne camelote chinoise ... c'est pas cher mais ça l'est pour ce que c'est ... à mon goût à éviter....",13 décembre 2023,Problème de livraison
Temu,1,"Je mais une étoile mais il en mérite 0.J’ai reçu ma commande hier et il me manque 1 article qui coûte presque 19€. J’ai demandé un remboursement ils s’obstine à dire que ces bien partie de leurs entrepôts hors a l’arrivée je ne les pas, et même avec la vidéo que j’ai faite a l’ouverture du colis ils s’obstine à ne pas vouloir me rembourser. Je vais voir avec paypal pour faire un litige. Mais la seul chose qu’ils ont gagné ces la perte d’un bon client.Suite le message de Temu en me disant de contacter le service client je les fait a des multiples reprises!! Et toujours la même réponse il et bien partie de l’entrepôt mais aucun n’a visionné ma vidéo, jusqu’à ce qu’une nouvelle personne plus compétente la visionne et me donne raison ils m’ont enfin remboursé après 2 ou 3 jours à leurs expliquer.Je change pas mon avis car ces lamentable d’être obligé d’insister alors que je leurs fournis la preuve.",31 mars 2024,Problème de service client
Temu,1,Matière de mauvaise qualités. C'est mauvais. Sandale acheter déchiré en quelques jours. Conseil ne pas acheter chez eux,01 avril 2024,Problème de qualité du produit
Temu,1,produits de très mauvaises qualités qui traversent toute la planète pour finir à la poubelle à fuir,21 mars 2024,Problème de qualité du produit
Temu,1,"J'ai commandé et reçu la marchandise mais malheureusement certains articles ne correspondaient pas. Je souhaitais donc retourner ces articles mais malgré plusieurs tentatives, temu me répond que je n'ai aucune commande. Je tente toutes les methodes disponibles sur le site pour retrouver cette commande;  Je la retrouve enfin en ligne mais pour le retour il faut le détail de celle-ci. Il me propose un code de vérification que je ne reçois jamais malgré la bonne adresse mail et en plus il note un mauvais numéro de téléphone alors que le livreur m'a bin appelé sr le bon. Ce site est malhonnête car pour commander vous n'avez aucun problème mais pour vous rembourser, il ne vous connaisse plus.",29 mars 2024,Problème de livraison
Temu,1,"Je suis très déçu de Temu, j’ai eu ma commande il me manquait deux articles j’ai demandé un remboursement pour ces deux articles ils ont refusé ma demande c’est une arnaque je vous déconseille de commander sur ce site et ça passe des commandes sans votre autorisation. Donc ne mettez pas votre carte bancaire sur le site, ça m’est déjà arrivé plusieurs fois",30 mars 2024,Problème de remboursement
Temu,1,Ne surtout pas commander déjà la commande met plus de 15 jours a arriver et quand la commande arrive c'est une catastrophe !!!! La matière des fringues c'est de la daube ne correspond pas aux produits commandés et pareil pour les produits de beauté abîmé mal fermé 😡😡😡 je suis trop déçu !!! Attention ne commandez pas des produits électroniques électroménager c'est de la vraie merdes et pas au norme ce qui veux dire que pour mettre le feu chez vous très gros risque !!!! Acheter plus cher mais de qualité en tout cas sa va me servir de leçon !,28 mars 2024,Problème de livraison
Temu,1,Nul nul article bas de gamme et des articles pas reçu,01 septembre 2023,Problème de livraison
Temu,1,"Ça fait le second avis que j'écris. Car aujourd'hui j'ai reçu un colis de Temu. Et fidèle a leur habitude, il manquait des articles !!!! Ça se produit un peu trop souvent, pour ne pas dire systématique. Et cette fois ci je l'ai fait livré en point relais, pour pas qu'ils puissent dire que ""j'ai mal regardé dans ma boîte à lettres""Site d'arnaque, sav inexistant, ils vont tourner en bourrique pour a la fin ne pas reconnaître leur faute.Certes c'est pas cher, mais la qualité est très loin d'être au rendez vous, sur le peu d'articles qu'ils veuillent bien expédiés. Ce sont des voleurs, fuiez, fuiez fuiez.",29 mars 2024,Problème de qualité du produit
Temu,3,"J'ai été déçue par ma commande, mais Temu m'a proposé le retour et le remboursement. Donc je ne mets pas d'avis négatif",23 mars 2024,Problème de livraison
Temu,1,Ne surtout pas achetez sur cette plateforme. Je ne suis fait pirater ma carte bancaire par eux. Je fais très peu d’achat en ligne mais suite à ma transaction sur ce site -800€ ! J’ai commencé en a parlé autour de moi et je me rends compte que je ne suis pas la seule.,25 mars 2024,Problème de remboursement
Temu,1,"Attention cette entreprise chinoise fera couler toutes les boites françaises, acheter français ou au moins européen si vous souhaitez de la qualité.",29 mars 2024,Problème de qualité du produit
Temu,1,"Tailles qui ne correspondent pas, colis renvoyé, et remboursement en ""crédit temu"" je veux mon argent pas des crédit, c'est quoi cette fraude ?",29 mars 2024,Problème de remboursement
Temu,3,"le service client n'est pas top j'ai renvoyer une commande ils m'on dit que le colis était vide du coup je perds de l'argent , j'étais une bonne cliente je vais aller ailleur",29 mars 2024,Problème de service client
Temu,2,J 'ai fait 2 achat de plusieurs pièces et j 'ai constatée la mauvaise qualité et la taille ne correspond pas du tout les robes transparenteLes chaussures ont un défaut,29 mars 2024,Problème de qualité du produit
Temu,1,c'est des escrocs j'ai par megarde passé une commande sur un compte .com au lieu de .fr la boite mail lié .com m'étant inaccessible je ne peut me connecter à ce compte à nouveau ils font la sourde oreille du coup il m'encule bien profond,28 mars 2024,Problème de livraison
Temu,2,Payé pour une livraison chrono.... reçu hors délais. Articles de mauvaise qualité.  Je ne conseille pas et je ne recommanderai plus.,28 mars 2024,Problème de qualité du produit
Temu,1,Ils vous font gagner a leurs roues de la fortune et l article que vous aviez choisis est subitement indisponible ! Pourtant il est bien disponible a la vente !!! Les chinois nous prennent pour des pigeons et ils n ont pas tort puisque qu on continue a s acharner a acheter leurs brol a deux balles.,26 mars 2024,Problème de remboursement
Temu,1,"ATTENTION À L'ARNAQUE DE TEMU ! LES REMBOURSEMENTS DEMANDÉS ET JUSTIFIÉS SONT SYSTÉMATIQUEMENT REFUSÉS !!!Bonjour Chers Amis,Ce Nouveau Message Authentique Et Avéré Relate Plusieurs Expériences Vécues Et donc Avérées Voire Authentiques !!! En Conséquence, Pour Vous Informer de la Gravité des Problèmes Rencontrés Avec L'Entreprise Chinoise Temu. En Effet, cela fait déjà Plus d'Une Semaine que Nous Nous Battons pour Obtenir Le Remboursement Intégral de 5 Articles Non/Jamais Reçus !Seulement Temu, Fort de Ses Pratiques Commerciales Et Douteuses Se Permet de Remettre Systématiquement Nos Propos Et Notre Bonne Foi En Doute !Ceci Afin de Gagner du Temps et Déclinant Ainsi Toute Responsabilité de sa Part Quant à L'Envoi des Marchandises Commandées Initialement!Ceci est Scandaleux de Laisser Croire à d'Honnêtes Clients qu'ils seront Remboursés Intégralement Alors que comme nous le savons tous,C'EST FAUX ! TEMU NE VEUT PAS RRMBOURSER LES ARTICLES MANQUANTS ET DONC NON REÇUS Et De Surcroît Rejette La Faute sur Le Consommateur ! De plus Notre Dernier Colis de Temu, Colis Contenant Plus de 25 Articles Nous a été Livré Déchiré Et Troué à Plusieurs Endroits Et Dans un Sac Plastique Sale Et Souillé ! Des Articles Sont Manquants à La Simple Vue Des Trous Faits sur Notre Colis ! C'est Honteux !Après Cela, Temu Ne Nous Croit Pas ??Même Le Facteur a Obligatoirement VU L'État de Notre Dernier Colis que Nous Avons Refusé Cette Fois-Ci ! C'est Scandaleux ! Plainte Déposée Le 25 Mars 2024 à 15h30 Pour Escroquerie Et Non-Respect des Conditions Générales de Vente Et de Remboursement Intégral En Cas d'Articles Non Reçus Et/Ou Endommagés ! Vol de Données...Voir Émission sur Temu de France 2 Télévision Concernant Les Pratiques Douteuses Mises en Place Par Le Nouveau Géant Chinois du e-commerce. Émission Télévisée Authentique Et RÉELLE Là Encore !!Merci Chers Amis pour Votre Lecture !Et Surtout Ne Vous Laissez Pas Happer Par Cette Grosse Machine Bien Huilée !Au Début, tout va bien... C'est Après que ça se gâte ! Merci ❤️ à Tous ❤️ pour Votre Lecture Chers Amis.Mr CORRIERE Fabrice ❤️❤️❤️Date de l'expérience: 21 mars 2024",21 mars 2024,Problème de remboursement
Temu,1,"Nullissime !!! C'est la 2ème fois que je commande et c'est la 2ème fois que les colis mettent le double de temps pour arriver !!! Du coup, l'événement pour lequel j'avais fait ma commande, est passé ! et les ballons en plastique étaient ingonflables !!!! je déconseille fortement",23 mars 2024,Problème de livraison
Temu,1,"Je n'ai jamais reçu le colis, ils m'ont demandés de faire une enquête, ce que j'ai fait auprès des voisins du gardien et rien, ils ont refusés de me rembourser, je ne conseille pas ce site. VOLEUR.",07 mars 2024,Problème de livraison
Temu,2,J'ai laissé mon panier rempli sans le valider et temu l'a validé et pris mes sous. Du coup je vais recevoir des trucs que je voulais pas forcément.Remboursez-moi la commande non validée!!!,22 mars 2024,Problème de remboursement
Temu,2,"Dans l'ensemble j'ai été assez déçu par la qualité des articles, mais c'est surtout la livraison qui pose problème.Les colis sont en retard 2 fois sur 3 ou n'arrivent pas, heureusement temu rembourse sans poser de difficultés quand on ne reçoit pas sa commande.Pour résumer, ça peut dépanner à pas cher, à condition que le colis arrive et que la livraison ne prenne pas plusieurs semaines, ce qui est malheureusement souvent le cas.J'évite ce site, trop de choses ne vont pas et ça ne va pas en s'améliorant.",25 mars 2024,Problème de qualité du produit
Temu,1,"Déplorable ! EDIT : J'ai donc ouvert une 4e demande suivant votre réponse, toujours le même retour , pas de remboursement alors que mon colis n'est pas arrivé ! Je me demande si le colis a même seulement été vraiment expédié !!!!?J'en suis à mon 3e ticket de réclamation ouvert car une partie de ma commande d'environ 100€ n'est pas arrivé.. aucune enquête auprès du transporteur, je n'ai droit qu'à des message automatique de clôture de ma demande!",22 mars 2024,Problème de remboursement
Temu,3,"Numéro de commande :PO-069-05378205747832518Colis Privé met mon tt petit colis à 10 km de chez moiLe 21.03.2024 Colis Privé devait mettre dans la boîte aux lettres de mon domicile un tout petit colis envoyé par Tému.Au lieu de cela, je reçois un sms me demandant d'aller le chercher dans un point relai à 12 km de chez moi !!!Tout ça m'a coûté beaucoup de temps et d'argent !! Sans doute parce que le livreur ne s'était pas équipé d'un passe pour ouvrir ma boîte aux lettres...C inacceptable !!! Et ça mérite moins 5 étoiles pour Colis Privé !",21 mars 2024,Problème de livraison
Temu,2,"Pour avoir passer trois commandes en quinze jours environ je peux dire que dans l'ensemble les produits vendus par Temu me semble de piètre qualité, les photos sur le site ne reflètent pas toujours la réelle qualité des produits. Exemple une bâche soit disant pour terrasse dont le film transparent est fin comme un sachet d'emballage, ou un chargeur de batterie dont l'écran LCD été mal fixé dans le boîtier, à l'ouverture de ce dernier j'ai constaté que sur les dix emplacements de fixation prévu il n'y avait en réalité que quatre vis de fixation. Seul point positif le service de livraison respecte les délais annoncés.",20 mars 2024,Problème de qualité du produit
Temu,1,"Pas honnête du tout!Suite à mon poste,ils m'ont dit de les contacter mais ils ne veulent pas toujourd pas me rembourser mes 2 colis que je n'ai jamais reçu!Je commande chez les concutrents,au moins je reçois mes colis et ils ont un bon service après vente!Temu ne vous envoie que des réponses automatiques et n'ont aucun service réclamation,si y'a un problème,tant pis!J'ai perdu 70 euros",15 mars 2024,Problème de remboursement
Temu,1,"J'ai eu ma première commande ce matin, franchement je suis déçu par plus de la moitié de ma commande, moule à gâteau = feuille de papier. Moule at glacons silicone=minuscule.Les couleurs des tee shirts ne correspondent pas, des chiffons! Breff site à éviter, c'est pas chère mais ça ne vaut rien c'est de l'arnaque! J'ai ôter de suite l'application car tout les jours nouvelles pubs!!",23 mars 2024,Problème de taille ou couleur
Temu,1,"Hérésie écologique, des produits made in china à prix dérisoire, c'est criminel en temps de crise climatique. À ce prix impossible que ces produits soient fabriqués dans de bonnes conditions, et cela incite à la surconsommation. A fuir !",23 mars 2024,Problème de qualité du produit
Temu,1,Le service client est déplorable ! Il me crédite de 36€ et quelques sur mon solde après avoir gagné un 100% remboursé sur une commande. Quelques heures après je vais pour commander en utilisant ce solde et je vois zéro euro… je contacte le service client qui me dit que non j’ai gagné 50€ de coupons à utiliser en fonction d’un minimum d’achat mais rien à voir avec mon souci en fait j’les avais bien vu les 50€ de coupons mais mon crédit s’est envolé et le gars me dit «désolé» non mais je suis choqué,22 mars 2024,Problème de service client
Temu,1,Extrêmement déçue par la qualité des articles contrairement à un autre site en ligne. Première et dernière commande sur ce site.,24 janvier 2024,Problème de qualité du produit
Temu,2,"Produit pas cher mais de qualité très très médiocre, pour exemple une ceinture homme...durée de vie 40 jours ...",21 mars 2024,Problème de qualité du produit
Temu,1,"Une vraie catastrophe. Service après vente inexistant.Tchat avec probablement un robot qui ne résoudra aucun problème. Au final, pas de solution donnée sur un appareil reçu ce jour et qui ne fonctionne pas. 19,98€ de perdus.Fuyez !",20 mars 2024,Problème de remboursement
Temu,1,"Je suis entrain de faire une commande de 25 euros et pendant l enregistrement de la carte bancaire une publicité s insérer Sous la forme de garantie , pensant que cela fait partir de la commande je clic .Et voilà que j ai  signé un contrat contre ma volonté.",20 mars 2024,Problème de livraison
Temu,3,"Envoi rapide mais produits cheap, de plus l'appli est très addictive je trouve ça dangereux pour les gens déjà sensible aux jeux de hasard... ça serait peut-être intéressant de ré-inventer ce système de marché peut-être en arrêtant de promouvoir la surconsommation",20 mars 2024,Problème de livraison
Temu,1,"Qualité médiocre.   Publicité mensongère !  Lors d une petite commande J avais ""soit disant"" 44 euros de cadeau a savoir housse de canapé. Une fois mon colis arrivé tapis de cuisine bof bof et une combinaison juste horrible que J ai renvoyé,il y avait pas les housses de canapé et comme part enchantement n apparaissait même plus sur le compte tenu ! Cadeau disparu..en même temps si la qualité est aussi mauvaise que le reste J ai rien perdu finalement..je déconseille fortement se site je préfère de mille fois shein.   PS je fais suite a votre réponse J ai déjà contacté le service client sur l application,la personne qui répond ne compte rien a ma réclamation ! Pourtant je me suis bien exprimé !C est peine perdue....",09 mars 2024,Problème de qualité du produit
